{"$schema":"https://json-schema.org/draft/2020-12/schema","$id":"https://carstenartur.github.io/Regelsuche/schemas/regelsuche-candidate-independent-corpus-freeze-receipt-v1.schema.json","title":"Regelsuche candidate-independent corpus freeze receipt v1","type":"object","additionalProperties":false,"required":["schema","amendmentId","benchmarkId","benchmarkSourceContentHash","caseCorpusContentHash","combinedPreregistrationHash","priorExecutionFoundationCommit","amendmentReason","executionStatusAtFreeze","executedCampaignsAtFreeze","executedEvaluationsAtFreeze","resultInspectionStatus","allowedNextStep","claimPolicy","externalNoveltyStatus","publicationAuthorized","contentHash"],"properties":{"schema":{"const":"regelsuche.candidate-independent-corpus-freeze-receipt/v1"},"amendmentId":{"const":"regelsuche-candidate-independent-autonomous-discovery-2026-07/case-payload-freeze/v1"},"benchmarkId":{"const":"regelsuche-candidate-independent-autonomous-discovery-2026-07/v1"},"benchmarkSourceContentHash":{"type":"string","pattern":"^sha256:[0-9a-f]{64}$"},"caseCorpusContentHash":{"type":"string","pattern":"^sha256:[0-9a-f]{64}$"},"combinedPreregistrationHash":{"type":"string","pattern":"^sha256:[0-9a-f]{64}$"},"priorExecutionFoundationCommit":{"type":"string","pattern":"^[0-9a-f]{40}$"},"amendmentReason":{"type":"string","minLength":100},"executionStatusAtFreeze":{"const":"NOT_STARTED"},"executedCampaignsAtFreeze":{"const":0},"executedEvaluationsAtFreeze":{"const":0},"resultInspectionStatus":{"const":"NO_EVALUATED_RESULTS_EXIST"},"allowedNextStep":{"const":"IMPLEMENT_EXECUTION_ADAPTERS_WITHOUT_MODIFYING_FROZEN_CASE_PAYLOADS"},"claimPolicy":{"const":"CORPUS_FREEZE_DOES_NOT_AUTHORIZE_BENCHMARK_SUCCESS_PUBLICATION_OR_EXTERNAL_NOVELTY"},"externalNoveltyStatus":{"const":"NOT_EVALUATED"},"publicationAuthorized":{"const":false},"contentHash":{"type":"string","pattern":"^sha256:[0-9a-f]{64}$"}}}
