{
  "allowedNextStep": "IMPLEMENT_EXECUTION_ADAPTERS_WITHOUT_MODIFYING_FROZEN_CASE_PAYLOADS",
  "amendmentId": "regelsuche-candidate-independent-autonomous-discovery-2026-07/case-payload-freeze/v1",
  "amendmentReason": "The original preregistration froze case identities, structural clusters, splits, budgets and metrics but omitted concrete challenge payloads. This amendment freezes all payloads before any evaluated campaign execution.",
  "benchmarkId": "regelsuche-candidate-independent-autonomous-discovery-2026-07/v1",
  "benchmarkSourceContentHash": "sha256:b1b37434b731d915a6ea206a22b9a3d7d36a0214f519e9cfa83c24bd0a8f8bca",
  "caseCorpusContentHash": "sha256:8cb19a8e33964c3d2296515cbf9aef3a62432410840cbf0c4062338bad5b1802",
  "claimPolicy": "CORPUS_FREEZE_DOES_NOT_AUTHORIZE_BENCHMARK_SUCCESS_PUBLICATION_OR_EXTERNAL_NOVELTY",
  "combinedPreregistrationHash": "sha256:e52ab9aa8895d16f667d42d8cf1d4787ec3fa401dc9e787002267c33f21269ed",
  "contentHash": "sha256:b7603b3454212ef094e23a521f0aa1a4600925ade3584fedd5042e7d5396f270",
  "executedCampaignsAtFreeze": 0,
  "executedEvaluationsAtFreeze": 0,
  "executionStatusAtFreeze": "NOT_STARTED",
  "externalNoveltyStatus": "NOT_EVALUATED",
  "priorExecutionFoundationCommit": "f4e221273088e8b044baa9db81f23d060c856fc5",
  "publicationAuthorized": false,
  "resultInspectionStatus": "NO_EVALUATED_RESULTS_EXIST",
  "schema": "regelsuche.candidate-independent-corpus-freeze-receipt/v1"
}
